{
  "$schema": "http://json-schema.org/draft-07/schema#",
  "type": "object",
  "required": [
    "url",
    "status",
    "content_type",
    "text"
  ],
  "properties": {
    "url": {
      "type": "string"
    },
    "status": {
      "type": "integer"
    },
    "content_type": {
      "type": "string"
    },
    "text": {
      "type": "string"
    },
    "truncated": {
      "type": "boolean"
    }
  },
  "additionalProperties": true
}